{
  "core_strategy": "keep-d10 (resolved from auto; autonomous run, no pre-answer)",
  "core_version_requirement": "^10 || ^11",
  "d10_support": "verified-static",
  "deferred_to_phase2": [
    "Soft deprecations (policy report, all work on every Drupal 11 core): user_load_by_mail() x3, user_load_by_name() x2 -> loadByProperties() + reset(); check_markup() x1 -> processed_text render array; text_summary() x2 -> TextSummary service (11.4+ only: needs a version guard while the floor is 10.0)",
    "Plugin/entity annotations -> PHP 8 attributes (@ContentEntityType, @Block, @Condition, @Filter, @QueueWorker; deprecated at discovery in 11.4, removed in 13.0)",
    "LegacyWidget::getOriginalWidget() reads ->original (silenced deprecation from 11.2, removed in 12.0): use core getOriginal() once the floor is ^11.2",
    "new static() x7 (PHPStan unsafe usage), \\Drupal::entityTypeManager() in WidgetReindexWorker::processItem() -> injected service, @var hints for EntityInterface inference (WidgetReindexWorker:68-69, LegacyWidgetsKernelTest:45-46)",
    "Optional hook_entity_operation() $cacheability parameter (must stay optional while the floor is below 11.3)",
    "Test metadata: PHPUnit attributes (#[Group], #[CoversClass], #[DataProvider]) and #[RunTestsInSeparateProcesses] on the Kernel test (exception in Drupal 12)",
    "Pre-existing hygiene: orphan service legacy_widgets.legacy_exporter, extra @logger.factory argument on legacy_widgets.counter, configure: route name, config/plugin schemas, undeclared legacy_widgets/node dependencies of legacy_widgets_extra"
  ],
  "deprecations_remaining": 0,
  "digests": {
    "applied": [],
    "reason": "DRUPILOT_USE_DIGESTS_RULES=false",
    "rejected": [],
    "skipped": true
  },
  "files_changed": 8,
  "learned_patterns": {
    "recorded": [
      "entity-get-original-collision",
      "config-form-base-typed-config",
      "form-logger-factory-redeclared",
      "revision-cache-id-collision",
      "service-class-case-mismatch"
    ],
    "scan": {
      "by_pattern": [],
      "catalog": ".drupilot/patterns.json",
      "catalog_exists": false,
      "hits": [],
      "machine_name": "legacy_widgets",
      "patterns": 0,
      "skipped": [],
      "subject": "web/modules/custom/legacy_widgets",
      "tool": "patterns",
      "total": 0
    }
  },
  "machine_name": "legacy_widgets",
  "manual_edits": [
    {
      "edit": "core_version_requirement ^10 -> ^10 || ^11 (legacy_widgets.info.yml) and ^8.8 || ^9 || ^10 -> ^10 || ^11 (submodule legacy_widgets_extra) via set-core-requirement.sh",
      "why": "Neither info.yml admitted Drupal 11; keep-d10 strategy (no BC break, minor bump). composer.json already declares require.php >=8.1 (the helper value), left as is."
    },
    {
      "change_record": "https://www.drupal.org/node/3295826",
      "edit": "src/Entity/LegacyWidget.php: getOriginal() renamed to getOriginalWidget(); caller in modules/legacy_widgets_extra/legacy_widgets_extra.module updated",
      "why": "Drupal 11.2+ EntityInterface::getOriginal(): ?static makes the untyped local method a class-declaration fatal at entity-type discovery (all 5 Kernel tests fataled in the baseline). A typed override would recurse through core __get(original); parent::getOriginal() does not exist on Drupal 10."
    },
    {
      "edit": "src/Form/SettingsForm.php: inject TypedConfigManagerInterface (config.typed) and forward it to ConfigFormBase::__construct()",
      "why": "ConfigFormBase::__construct() requires the typed config manager from Drupal 11.0 (ArgumentCountError otherwise); the extra argument is ignored by 10.0/10.1 (core matrix: runtime-tolerated)."
    },
    {
      "edit": "src/Form/WidgetImportForm.php: stop redeclaring FormBase::$loggerFactory (setLoggerFactory() in the constructor); $entityTypeManager promoted as protected, non-readonly",
      "why": "private readonly redeclaration of LoggerChannelTrait property is a class-load fatal on PHP 8.1+ and breaks DependencySerializationTrait (pre-existing on Drupal 10, same fatal on 11)."
    },
    {
      "edit": "src/LegacyWidgetStorage.php: unused helper buildRevisionCacheId() renamed to buildWidgetRevisionCacheId()",
      "why": "Drupal 11.3+ core declares and uses ContentEntityStorageBase::buildRevisionCacheId(): the helper would silently override core revision cache ids (scan-signature-changes warn)."
    },
    {
      "edit": "legacy_widgets.services.yml: legacy_widgets.lookup class WidgetLookUp -> WidgetLookup",
      "why": "check-port-safety.sh class-case error (pre-existing): fatal on case-sensitive filesystems; the gate must exit 0."
    }
  ],
  "metadata_lint": {
    "checks_run": [
      "config-schema",
      "plugin-schema",
      "configure-route",
      "services-class",
      "services-arity",
      "submodule-core-req",
      "undeclared-deps"
    ],
    "findings": [
      {
        "check": "services-class",
        "extension": "legacy_widgets",
        "file": "legacy_widgets.services.yml",
        "line": 12,
        "message": "Service 'legacy_widgets.legacy_exporter' points at class Drupal\\legacy_widgets\\Export\\LegacyExporter, but src/Export/LegacyExporter.php does not exist (orphan service): fetching it is a fatal error.",
        "severity": "error",
        "suggestion": "Remove the service definition, or restore/rename the class."
      },
      {
        "check": "config-schema",
        "extension": "legacy_widgets",
        "file": "config/install/legacy_widgets.settings.yml",
        "line": 1,
        "message": "Config 'legacy_widgets.settings' has no schema in config/schema/*.schema.yml: strict config schema checks (Kernel/Functional tests, config inspector) fail on it and its values are not typed or translatable.",
        "severity": "warn",
        "suggestion": "Add a 'legacy_widgets.settings:' entry (type: config_object for simple config) to config/schema/legacy_widgets.schema.yml."
      },
      {
        "check": "configure-route",
        "extension": "legacy_widgets",
        "file": "legacy_widgets.info.yml",
        "line": 6,
        "message": "configure: 'legacy_widgets.settings' names a route that no *.routing.yml of the extension defines: core drops the Configure link from /admin/modules silently (unless a route subscriber or another module provides it).",
        "severity": "warn",
        "suggestion": "Point it at the real route ('legacy_widgets.settings_form'?)."
      },
      {
        "check": "services-arity",
        "extension": "legacy_widgets",
        "file": "legacy_widgets.services.yml",
        "line": 3,
        "message": "Service 'legacy_widgets.counter' passes 3 argument(s) but Drupal\\legacy_widgets\\WidgetCounter::__construct() takes 2: PHP silently ignores the extra one(s) (a stale argument, or a constructor that lost a parameter).",
        "severity": "warn",
        "suggestion": "Drop the extra argument(s), or restore the constructor parameter they were meant for."
      },
      {
        "check": "plugin-schema",
        "extension": "legacy_widgets",
        "file": "src/Plugin/Condition/WidgetsEnabledCondition.php",
        "line": 1,
        "message": "Condition plugin 'legacy_widgets_enabled' has its own settings but no 'condition.plugin.legacy_widgets_enabled' schema: only core's generic 'condition.plugin.*' covers it, so its extra settings fail strict config schema checks.",
        "severity": "warn",
        "suggestion": "Add 'condition.plugin.legacy_widgets_enabled:' to config/schema/legacy_widgets.schema.yml describing the plugin's settings."
      },
      {
        "check": "plugin-schema",
        "extension": "legacy_widgets",
        "file": "src/Plugin/Filter/WidgetSummaryFilter.php",
        "line": 1,
        "message": "Filter plugin 'legacy_widgets_summary' has its own settings but no 'filter_settings.legacy_widgets_summary' schema: only core's generic 'filter_settings.*' covers it, so its extra settings fail strict config schema checks.",
        "severity": "warn",
        "suggestion": "Add 'filter_settings.legacy_widgets_summary:' to config/schema/legacy_widgets.schema.yml describing the plugin's settings."
      },
      {
        "check": "undeclared-deps",
        "extension": "legacy_widgets_extra",
        "file": "modules/legacy_widgets_extra/legacy_widgets_extra.module",
        "line": 8,
        "message": "'legacy_widgets_extra' uses project module 'legacy_widgets' (class,service) without declaring it in legacy_widgets_extra.info.yml dependencies: installing 'legacy_widgets_extra' alone fails or breaks at runtime.",
        "severity": "warn",
        "suggestion": "Add '- legacy_widgets:legacy_widgets' to dependencies:."
      },
      {
        "check": "undeclared-deps",
        "extension": "legacy_widgets_extra",
        "file": "modules/legacy_widgets_extra/legacy_widgets_extra.module",
        "line": 9,
        "message": "'legacy_widgets_extra' uses core module 'node' (class) without declaring it in legacy_widgets_extra.info.yml dependencies: installing 'legacy_widgets_extra' alone fails or breaks at runtime.",
        "severity": "warn",
        "suggestion": "Add '- drupal:node' to dependencies:."
      }
    ],
    "generated_at": "2026-10-03T23:51:40Z",
    "subject": "web/modules/custom/legacy_widgets",
    "subject_digest": "9b65217f439f7ffddeb582d7ce1bd589e90312d0c46ce7f6f05306c791f863f9",
    "tool": "lint-extension-metadata",
    "totals": {
      "error": 1,
      "info": 0,
      "warn": 7
    }
  },
  "patch": "web/modules/custom/legacy_widgets/legacy_widgets-port-to-drupal-11.patch",
  "phase": "port",
  "php_target": "8.3",
  "port_safety": {
    "base": "HEAD",
    "checks": [
      "plugin-di",
      "removed-use",
      "static-factory",
      "fapi-callable",
      "serialization",
      "override-attribute",
      "class-case"
    ],
    "core_requirement": "^10 || ^11",
    "diff_mode": true,
    "drupal_root": "<LAB>/m1/dpl-m1-flow-d11",
    "errors": 0,